{
  "id": "crooked_pipe",
  "name": "Crooked Pipe District",
  "description": "A warren of goblin pubs, back rooms, and quiet corners where the architecture of The Undertaking reveals itself to those who walk slowly.",
  "spawn_room": "spawn",
  "rooms": {
    "spawn": {
      "id": "spawn",
      "name": "The Crooked Pipe",
      "description": "A low-ceilinged goblin pub full of smoke, murmurs, and bad ideas. Nothing important happens here. At least, nothing obvious. A battered door leads west to the street.",
      "coords": [
        0,
        0,
        0
      ],
      "exits": {
        "north": "front_parlour",
        "down": "quiet_booth"
      },
      "items": []
    },
    "front_parlour": {
      "id": "front_parlour",
      "name": "Front Parlour",
      "description": "A tidy room near the door. Words arrive here, are glanced at, and quietly passed along. No judgement is made. No action is taken.",
      "coords": [
        0,
        5,
        0
      ],
      "exits": {
        "south": "spawn",
        "east": "back_parlour"
      },
      "items": []
    },
    "back_parlour": {
      "id": "back_parlour",
      "name": "Back Parlour",
      "description": "A narrow space with a watchful goblin at the door. Some are allowed to speak. Others are turned away. Nothing else happens here.",
      "coords": [
        10,
        5,
        0
      ],
      "exits": {
        "west": "front_parlour",
        "south": "snug"
      },
      "items": []
    },
    "snug": {
      "id": "snug",
      "name": "The Snug",
      "description": "A small, serious room. This is where loose language stops and intent becomes something the system can recognise.",
      "coords": [
        10,
        0,
        0
      ],
      "exits": {
        "north": "back_parlour",
        "west": "smoking_room",
        "down": "cellar"
      },
      "items": []
    },
    "smoking_room": {
      "id": "smoking_room",
      "name": "Smoking Room",
      "description": "Cold, solid, and unromantic. The world is what it is here. Reasons are irrelevant. Truth is enforced.",
      "coords": [
        5,
        0,
        0
      ],
      "exits": {
        "east": "snug"
      },
      "items": []
    },
    "cellar": {
      "id": "cellar",
      "name": "The Cellar",
      "description": "Bare stone walls and stacked ledgers. Everything above rests on what is written here. Nothing here knows why it matters.",
      "coords": [
        10,
        0,
        -1
      ],
      "exits": {
        "up": "snug",
        "south": "dark_passage"
      },
      "items": []
    },
    "dark_passage": {
      "id": "dark_passage",
      "name": "The Dark Passage",
      "description": "Footsteps echo. Messages pass through the air. Someone might be listening. No promises are made.",
      "coords": [
        10,
        -5,
        -1
      ],
      "exits": {
        "north": "cellar",
        "west": "quiet_booth"
      },
      "items": []
    },
    "quiet_booth": {
      "id": "quiet_booth",
      "name": "Quiet Booth",
      "description": "A corner booth with old notes carved into the table. Some things reacted. Others did not. Silence is recorded either way.",
      "coords": [
        0,
        0,
        -1
      ],
      "exits": {
        "east": "dark_passage",
        "up": "spawn"
      },
      "items": []
    }
  },
  "items": {}
}
