{
  "id": "ledgerfall_alley",
  "name": "Ledgerfall Alley",
  "description": "A grimy, dark alley.",
  "spawn_room": "spawn",
  "rooms": {
    "spawn": {
      "id": "spawn",
      "name": "Starting Room",
      "description": "To the East is an old broken door hanging ajar on its hinges.",
      "exits": {
        "east": "broken_door",
        "west": "ledgerfall_market"
      },
      "items": [],
      "coords": [
        0,
        0,
        0
      ]
    },
    "broken_door": {
      "id": "broken_door",
      "name": "Broken Door",
      "description": "Skittering sounds can be heard from behind the door.",
      "coords": [
        5,
        0,
        0
      ],
      "exits": {
        "west": "spawn",
        "south": "dark_hallway"
      },
      "items": []
    },
    "dark_hallway": {
      "id": "dark_hallway",
      "name": "Dark Hallway",
      "description": "A dark hallway. The sound of tiny feet skittering on stone.",
      "coords": [
        5,
        -5,
        0
      ],
      "exits": {
        "north": "broken_door"
      },
      "items": []
    },
    "locked_door": {
      "id": "locked_door",
      "name": "Sturdy Locked Door",
      "description": "You should have brought an Orc.",
      "coords": [
        0,
        -5,
        0
      ],
      "exits": {
        "east": "dark_hallway",
        "south": "back_door"
      },
      "items": []
    },
    "ledgerfall_market": {
      "id": "ledgerfall_market",
      "name": "Ledgerfall Market",
      "description": "To the West you see a bustling market place.",
      "coords": [
        -5,
        0,
        0
      ],
      "exits": {
        "east": "spawn"
      },
      "items": []
    },
    "back_door": {
      "id": "back_door",
      "name": "Back Door",
      "description": "This door looks well maintained.",
      "coords": [
        0,
        -10,
        0
      ],
      "exits": {
        "north": "locked_door",
        "south": "quiet_street"
      },
      "items": []
    },
    "quiet_street": {
      "id": "quiet_street",
      "name": "Quiet Street",
      "description": "A suspiciously quite street.",
      "coords": [
        0,
        -15,
        0
      ],
      "exits": {
        "north": "back_door"
      },
      "items": []
    }
  },
  "items": {}
}
